filename,category,primary_subject,description,colors,mood,suggested_use,species_identified,location_type,quality_notes
manta-ray-silhouette-underwater.JPG,ray,manta ray silhouette,"Manta ray silhouette against light from below","blue,silhouette","majestic,graceful","megafauna,rays,dramatic imagery",manta ray,open water,"dramatic silhouette"
manta.jpg,logo,manta ray logo,"Black and white manta ray logo/icon in circle","black,white,graphic","clean,iconic,logo","branding,logo,icon use",manta ray graphic,n/a,"logo/branding asset"
marine-iguana-galapagos-beach.jpg,reptile,marine iguana,"Marine iguana on Galapagos beach","gray,brown,coastal","prehistoric,unique","Galapagos,unique species,marine reptile",marine iguana,Galapagos beach,"good species shot"
marine-iguana-sand-galapagos.jpg,reptile,marine iguana on sand,"Marine iguana crawling on white sand","gray,white sand","ancient,reptilian","Galapagos section,marine reptiles",marine iguana,Galapagos,"good angle"
megsie.webp,portrait,team member Megsie,"Woman smiling - professional headshot","neutral background,professional","friendly,professional","team page",human - Megsie,professional portrait,"excellent headshot"
molly.jpg,portrait,team member Molly,"Female diver in water with kelp on head smiling","blue water,dive gear","fun,fieldwork,diving","team page,diving culture",human - Molly,ocean surface,"fun diving shot"
moorea-mountain-tropical-island-view.jpeg,landscape,Moorea island view,"Tropical mountain island view - Moorea style","green,tropical,dramatic peaks","tropical paradise,dramatic","tropical research site,island landscape",n/a,Moorea/French Polynesia,"stunning island shot"
norht-sea-fishing.jpeg,fishing,fishing net haul,"Large net full of fish being hauled - commercial fishing","fish,nets,commercial","industrial,abundant","fisheries section,commercial fishing",various fish,commercial fishing,"shows fishing scale"
ocean-wave-kelp-breaking.jpeg,wave,wave with kelp,"Breaking ocean wave with kelp visible","turquoise,white foam,kelp","dynamic,powerful,coastal","coastal dynamics,kelp distribution",kelp in wave,coastal,"dramatic wave shot"
overwater-bungalows-split-view-reef-fish.jpeg,landscape,split view bungalows and reef,"Split above/below showing overwater bungalows and reef fish","turquoise,tropical,fish","tropical paradise,dual perspective","tropical research,tourism intersection,hero",striped fish,Moorea/French Polynesia,"excellent split shot"
pacific-herring-net.jpeg,fishing,herring catch,"Net full of Pacific herring - commercial/research catch","silver fish,net,water","abundance,fisheries","Pacific fisheries,herring,forage fish",Pacific herring,fishing net,"shows herring abundance"
parrotfish.jpeg,fish,parrotfish on reef,"Colorful parrotfish swimming over coral reef with sea fan","rainbow,blue,coral","colorful,reef grazer","parrotfish,reef fish,coral interactions",parrotfish species,coral reef,"excellent colorful shot"
purple-urchin.jpeg,invertebrate,purple sea urchin,"Vivid purple sea urchin with spines extended - dramatic black background","purple,spines,dark","striking,detailed","urchin biology,California,invertebrates",purple sea urchin,dark background,"stunning macro"
raine.jpg,portrait,team member Raine,"Woman smiling outdoors near waterfall","nature background,casual","friendly,outdoors","team page",human - Raine,outdoor/waterfall,"nice natural setting"
red-pencil-urchin-coral-reef.JPG,invertebrate,red pencil urchin,"Red pencil urchin on coral reef with sunlight","red,coral,light","tropical,colorful","urchin species,tropical reef",red pencil urchin,tropical reef,"vibrant reef shot"
red-spotted-coral-crab-macro.jpeg,crustacean,coral crab macro,"Red-spotted coral crab detailed macro on coral polyps","red,spotted,coral","intimate,detailed,symbiotic","crab-coral research,macro",Trapezia rufopunctata,coral,"excellent macro detail"
research-team-boats-turquoise-lagoon.webp,fieldwork,research team on boats,"Research team on boats in turquoise lagoon - French Polynesia","turquoise,boats,team","collaborative,fieldwork","team page,research methods,fieldwork",humans - team,French Polynesia lagoon,"excellent team fieldwork shot"
research-team-group-photo-beach.jpeg,team,research team group photo,"Group of 7 researchers posed on beach with cliffs","beach,team,casual","collaborative,friendly","team page,about us,group photo",humans - full team,beach California,"excellent team photo"
researcher-on-boat-ocean-fieldwork.jpg,fieldwork,researcher on boat,"Researcher in wetsuit sitting on boat - black and white","black and white,ocean,boat","documentary,fieldwork","research methods,fieldwork",human researcher,boat at sea,"artistic fieldwork shot"
rock-crab-kelp-tidepool.jpg,crustacean,rock crab,"Large rock crab in kelp tidepool environment","red-brown,kelp,tidepool","robust,intertidal","California tidepools,crab species",rock crab,tidepool,"good tidepool species"
rocky-beach-cove-panorama.jpeg,landscape,rocky beach panorama,"Panoramic view of rocky beach cove - California coast","blue,rocky,coastal","scenic,expansive","California coastline,research site",n/a,California coast,"beautiful panorama"
rocky-tidepool-coastline-sunset.jpg,landscape,tidepool coastline sunset,"Rocky coastline with tidepools at sunset with researchers","golden,rocky,sunset","golden hour,fieldwork","tidepool research,California coast,hero",researchers,California coast,"stunning fieldwork scene"
sally-lightfoot-crab-galapagos.jpg,crustacean,Sally Lightfoot crab,"Bright red-orange Sally Lightfoot crab on rock","red,orange,vibrant","colorful,iconic","Galapagos,crab species",Sally Lightfoot crab,Galapagos,"vibrant crab shot"
sam.jpg,portrait,team member Sam,"Woman with long brown hair smiling - professional portrait","green background,professional","friendly,professional","team page",human - Sam,professional portrait,"excellent headshot"
schooling-jacks-fish-underwater.jpeg,fish,schooling jacks,"Large dense school of jacks forming baitball shape","silver,blue,schooling","dramatic,abundance","fish behavior,schooling,predator-prey",jack fish species,open water,"dramatic schooling shot"
scuba-divers-shark-deep-blue.JPG,diving,divers with shark,"Multiple scuba divers in deep blue with shark swimming by","blue,divers,shark","adventurous,dramatic","shark diving,research diving",shark + divers,deep water,"dramatic encounter"
seagrass.jpeg,habitat,seagrass meadow,"Underwater seagrass meadow with sunlight","green,light rays,blue","peaceful,productive","seagrass ecosystems,blue carbon",seagrass,seagrass bed,"beautiful seagrass shot"
seattle-urban-coastline.jpeg,landscape,Seattle skyline,"Seattle skyline with Space Needle and waterfront","city,water,sunset","urban coastal,iconic","urban oceans,Pacific Northwest,human coasts",n/a,Seattle,"urban coastal context"
sheephead.jpeg,fish,California sheephead,"Male California sheephead close portrait","red,black,distinctive","bold,California icon","California kelp species,fish portrait","California sheephead (Semicossyphus pulcher)",kelp forest,"excellent portrait"
spiny-lobsters-group-reef-hideout.jpeg,crustacean,spiny lobster group,"Group of spiny lobsters hiding in reef crevice","red,lobster,colorful reef","social,hiding,reef","lobster ecology,invertebrates",spiny lobsters,reef crevice,"good group shot"
squid-silhouette-blue-ocean.JPG,cephalopod,squid silhouette,"Squid silhouette against blue ocean surface","blue,silhouette","graceful,minimal","cephalopods,pelagic life",squid,open water,"artistic silhouette"
stingrays-group-sandy-bottom.JPG,ray,stingray group,"Group of 4 stingrays gliding over sandy bottom in clear water","sandy,stingray,clear","graceful,group,shallow","rays,sandy habitats,snorkel encounters",stingrays,sandy shallows,"excellent group shot"
trapezia-coral-crab-hiding.jpg,crustacean,Trapezia crab hiding,"Red-spotted Trapezia crab hiding in coral polyps","red,spotted,coral","hidden,symbiotic","crab-coral symbiosis,guard crabs",Trapezia sp.,coral,"good symbiosis macro"
trapezia-coral-crab-red-spotted.jpg,crustacean,Trapezia crab macro,"Red and white spotted Trapezia crab dramatic macro","red,white,spotted","striking,detailed","crab research,macro,symbiosis",Trapezia sp.,coral,"stunning crab macro"
tropical-beach-palm-trees-waves.JPG,landscape,tropical beach,"Tropical beach with palm trees and waves","blue,sand,palms","tropical,paradise","tropical research locations,beach",n/a,tropical beach,"classic beach shot"
tropical-island-aerial-view-lagoon-reef.jpeg,landscape,tropical island aerial panorama,"Stunning aerial panorama of tropical island with lagoon and reef","turquoise,green mountains,aerial","expansive,paradise,dramatic","hero image,island ecosystems,aerial",n/a,Moorea/French Polynesia,"excellent hero potential"
tropical-island-split-view-coral-reef-shark.jpeg,composite,split view island reef shark,"Split shot with tropical island above and coral reef with shark below","tropical,coral,shark,split","dramatic,comprehensive","hero image,tropical research,sharks",shark + butterflyfish + coral,tropical island,"excellent split perspective"
tropical-palm-island-ocean.jpeg,landscape,isolated palm island,"Small isolated palm island in turquoise ocean","turquoise,green palms,sky","isolated,paradise,pristine","tropical ecosystems,island research",n/a,tropical island,"iconic island shot"
urchin-barron.jpg,invertebrate,urchin barren,"Mass of purple sea urchins covering reef - urchin barren","purple,mass,rocky","concerning,overgrazed","urchin barrens,ecosystem shifts,kelp decline",purple sea urchins,rocky reef,"important ecosystem change"
whale-eating-herring.jpeg,marine mammal,humpback whale feeding,"Humpback whale lunge feeding on herring with mouth open","gray,splashing,dramatic","powerful,feeding","marine mammals,predator-prey,whales",humpback whale + herring,surface,"dramatic feeding shot"
whitemouth-moray-eel-closeup.JPG,fish,whitemouth moray closeup,"Whitemouth moray eel face closeup showing spotted pattern","brown,white spots,detailed","characterful,detailed","eel species,reef fish,macro",whitemouth moray eel,coral reef,"excellent eel portrait"
whitemouth-moray-eel-coral.JPG,fish,whitemouth moray in coral,"Whitemouth moray eel emerging from coral with blue fish","spotted,coral,blue fish","natural,habitat","eel-coral relationship,reef fish",whitemouth moray eel,coral reef,"good habitat context"
foragefish.jpeg,fish,forage fish school,"Dense massive school of small silvery forage fish (herring/anchovy/sardine type)","silver,blue,dense","abundance,schooling,dramatic","fisheries management,forage fish articles,ecosystem-based management",forage fish (herring/anchovy),open water,"excellent dense baitball shot"
